,Contents,Date,Summary,Title,URL
15,"Computer scientist David Blaauw pulls a small plastic box from his bag. He carefully uses his fingernail to pick up the tiny black speck inside and place it on the hotel caf table. At 1 cubic millimeter, this is one of a line of the worlds smallest computers. I had to be careful not to cough or sneeze lest it blow away and be swept into the trash.  Blaauw and his colleague Dennis Sylvester, both IEEE Fellows and computer science professors at the University of Michigan, were in San Francisco in February to present 10 papers related to these micromote computers at the IEEE International Solid-State Circuits Conference (ISSCC). Theyve been presenting different variations on the tiny devices for a few years now.  The broad goal of the Michigan Micro Mote (M3) initiative is to make smarter, smaller sensors for medical devices and the Internet of Thingssensors that can do more with less energy. Many of the microphones, cameras, and other sensors that make up the eyes and ears of smart devices are always on alert, and frequently they beam personal data into the cloud because they cant analyze it themselves. Some have predicted that by 2035, there will be 1 trillion such devices. If youve got a trillion devices producing readings constantly, were going to drown in data, says Blaauw. By developing tiny, energy-efficient computing sensors that can do analysis on board, Blaauw and Sylvester hope to make these devices more secure, while also saving energy and bandwidth.  In San Francisco, they described micromote designs that use only a few nanowatts of power to perform tasks such as distinguishing the sound of a passing car and measuring temperature and light levels. They showed off a compact radio that can send data from the small computers to receivers 20meters awaya considerable boost compared with the 50-centimeter range they reported last year. They also described their work with TSMC (Taiwan Semiconductor Manufacturing Co.) on embedding flash memory into the devices and a project to bring on board dedicated, low-power hardware for running artificial intelligence algorithms called deep neural networks.  Blaauw and Sylvester say they take a holistic approach to adding these new features without ramping up power consumption. Theres no one answer to how they and their engineers do it, says Sylvester. If anything, its smart circuit design, Blaauw adds. (They pass ideas back and forth rapidly, not finishing each others sentences but something close to it.)  The memory research is a good example of how the right trade-offs can improve performance, says Sylvester. Previous versions of the micromotes used 8 kilobytes of SRAM, which makes for a pretty low-performance computer. To record video and sound, the tiny computers need more memory. So the group worked with TSMC to bring flash memory on board. Now they can make tiny computers with 1 megabyte of storage.  Flash can store more data in a smaller footprint than SRAM, but it takes a big burst of power to write to the memory. With TSMC, the group designed a new memory array that uses a more efficient charge pump for the writing process. The memory arrays wind up being a bit less dense than TSMCs commercial products, but still much better than SRAM. We were able to get huge gains with small trade-offs, says Sylvester.  Another micromote they presented at ISSCC incorporates a deep-learning processor that can operate a neural network while using just 288 microwatts. Neural networks are artificial intelligence algorithms that perform well at tasks such as face and voice recognition. They typically demand both large memory banks and intense processing power, and so theyre usually run on banks of servers often powered by advanced GPUs. Some researchers have been trying to lessen the size and power demands of deep-learning AI with dedicated hardware thats specially designed to run these algorithms. But even those processors still use over 50 milliwatts of powerfar too much for a micromote. The Michigan group brought down the power requirements by redesigning the chip architecture, for example by situating four processing elements within the memory (in this case, SRAM) to minimize data movement.  The idea is to bring neural networks to the Internet of Things. A lot of motion detection cameras take pictures of branches moving in the windthats not very helpful, says Blaauw. Security cameras and other connected devices are not smart enough to tell the difference between a burglar and a tree, so they waste energy sending uninteresting footage to the cloud for analysis. Onboard deep-learning processors could make better decisions, but only if they dont use too much power. The Michigan group imagines that deep-learning processors could be integrated into many other Internet-connected things besides security systems. For example, an HVAC system could decide to turn the air-conditioning down if it sees several people putting on their coats.  After demonstrating many variations on these micromotes in an academic setting, the Michigan group hopes they will be ready for market in a few years. Blaauw and Sylvester say their startup company, CubeWorks, is currently prototyping devices and researching markets. The company was quietly incorporated in late 2013. Last October, Intel Capital announced it had invested an undisclosed amount in the tiny computer company.  A version of this article appeared in the Tech Talk blog on 10 February 2017.",2017-03-28,Photo: University of Michigan and TSMC Mighty and Mini: One of several varieties of the University of Michigan millimeter-scale computers ...,Speck-Size Computers: Now With Deep Learning,http://spectrum.ieee.org/semiconductors/processors/specksize-computers-now-with-deep-learning
16,"Deep learning has become the technology du jour of late and few companies have advanced the field as much across as many areas or integrated the technology as completely into their operations as Google and its Alphabet affiliates. In keeping with Google's push to externalize its innovations, the company's Next 17 cloud conference featured a number of AI-related announcements and a general theme of democratizing access to the worlds most powerful deep learning systems.  In recent years Google and its sister companies have become synonymous with advancing the AI revolution at a frenzied pace and infusing deep learning across the companys services. Perhaps most famously, last year Deep Minds AlphaGo became the first machine to beat a top Go player, while Waymos driverless cars have become symbols of the autonomous driving revolution. But, it has been the quiet AI revolution, shaping everything from Google Translate to Google Search that has had the greatest impact on Google itself, bringing the power of automated reasoning to bear on almost everything the company does. As it has built up the massive infrastructure to train and run these AI systems, Google has begun bringing these same tools to the masses.  Some companies have built their own AI research units and need to build highly customized models for specific applications. Yet, in doing so they quickly run up against the immense hardware requirements of building large deep learning models, often requiring entire accelerator farms for rapid iteration. In Googles case it offers a hosted deep learning platform called Cloud Machine Learning Engine that takes care of the hardware needs of deep learning development, allowing companies to focus on building their models and offload the computing requirements to Google. After all, few companies have invested so much in AI that they have built their own custom accelerator hardware like Google did with its Tensor Processing Units (TPUs).  Of course, while algorithmic and hardware advances play a significant role in the AI revolution, it is difficult to make true progress in the field without data. Current AI systems require vast volumes of data to learn a new concept. Whereas a human can see a single picture of a new object and instantly recognize it from there forward, a similar AI system requires a tremendous corpus of images depicting the object from many angles to properly build a robust internal representation of it. This means that companies like Google have a significant advantage in being able to muster hundreds of millions of images to build a visual representation of the planet for applications likegeolocation.  In short, the deep learning revolution is powered by data and few companies have as much data as Google. This means that when it comes to deep learning systems, it is easy to find tools, but hard to find pretrained models that you can actually use. I personally experienced this in my pursuit of a system that was robust enough to catalog global news imagery  after trying countless systems over the last several years, I found many that offered some really incredible technology, but none that offered rich prebuilt cataloging with tens of thousands of labels and which worked well on imagery sourced from the non-Western world, until I came across Googles Cloud Vision system.  In fact, this is a common need of many companies  they are interested in building services for their customers, not conducting AI research. In following its externalization trend, Google has risen to this challenge by releasing many of its internal AI systems as public cloud APIs. Cloud Vision accepts any arbitrary image and catalogs objects and activities, OCRs text, recognizes the location depicted, estimates the emotion of human faces and even flags whether the image depicts violence. All with a single API call and with results returned in just a few seconds and infinitely scalable. Cloud Speech performs live speech to text in over 80 languages and, unlike legacy speech transcription systems, requires no training and is incredibly robust to noise. Cloud Natural Language accepts arbitrary text in English, Spanish and Japanese and outputs a robust dependency parse tree, recognizes key entities and even performs sentiment analysis. At Next 17, Google expanded this lineup with itslatest tool, Cloud Video Intelligence, which takes a video and segments it into scenes and identifies the major topics and activities in each scene, allowing one to take a massive video archive and instantly index it to make it topically searchable.  What makes these APIs so powerful is that they are exposed as a simple API and really do just work right out of the box. You simply make an API call with your dataand after a few seconds get back the results of pretrained algorithms built by some of the top AI researchers in the world. The massive complexity of deep learning is all hidden behind a simple API call and you can even string API calls together to build unimaginably complex workflows with just a few lines of code.  Teowakis Javier Ramirez offers a glimpse at just how easy it is to rapidly build an entire workflow(and an immensely powerful one at that) from these APIs with just a few minutes of time and a few lines of code. In his tutorial, he takes a YouTube video of British Prime Minister Theresa Mays inaugural speech and feeds it through the Cloud Speech API to instantly generate a high quality textual transcript. He then feeds that transcript through Cloud Natural Language to extract the primary mentioned entities (along with links to their Wikipedia pages for more information) and calculate a general sentiment of the speech. It took just a few lines of code making a few API calls to take a YouTube video, transcribe it, extract key entities and sentiment code it. Even more amazingly, the entire workflow could be scaled up to run across millions of videos without a single change. This is the power of cloud.  Putting this all together, just as Google is externalizing its services and security models, it has also been opening the doors to its incredible AI advances, offering both a hosted AI environment for companies looking to build their own models and an ever-growing array of pretrained models that just work out of the box and allow companies to build complex applications with just a few API calls. It was clear from the number of sessions at Next that involved AI and its heavy presence in the keynotes that Google is betting big on rolling AI into the enterprise. In the end, Google has effectively democratized access to some of the worlds most advanced AI algorithms by making them so easy to use (literally just an API call away) that even the smallest businesses can now leverage the full power of deep learning to revolutionize how they do business.",2017-03-24,Deep learning has become the technology du jour of late and few companies have advanced the field as much across as many areas or ...,Recapping Google NEXT 2017: Deep Learning As A Service,http://www.forbes.com/sites/kalevleetaru/2017/03/24/recapping-google-next-2017-deep-learning-as-a-service/
17,"Artificial intelligence has reached peak hype. News outletsreport thatcompanies have replaced workers with IBM Watson and that algorithms are beating doctors at diagnoses. New AI startups pop up everyday, claiming to solve all your personal and businessproblems with machine learning.  Ordinary objects like juicers and Wi-Firouters suddenly advertise themselves as powered by AI. Not only can smart standing desks remember your height settings, they can also order you lunch.  Much of the AIhubbubis generated by reporters whove never trained a neural network and by startups or those hoping to be acqui-hired for engineering talent despite not having solved any real business problems. No wonder there are so many misconceptions about what AI can and cannot do.  Neural networks were invented in the 60s, butrecent boosts in big data and computational power made them actually useful. A new discipline called deep learning has arisen that can apply complex neural network architectures to model patterns in data more accurately than ever before.  The results are undeniably impressive. Computers can now recognize objects in images and video and transcribe speech to text better than humans can. Google replaced Google Translates architecture with neural networks, and now machine translation is also closing in on human performance.  The practical applications are mind-blowing as well. Computers can predict crop yield better than the USDA and indeed diagnose cancermore accurately than elite physicians.  John Launchbury, a director at DARPA, describes three waves of artificial intelligence:  1. Handcrafted knowledge, or expert systems like IBMs Deep Blue or Watson  3. Contextual adaption, which involves constructing reliable, explanatory models for real-world phenomena using sparse data, like humans do  As part of thecurrent second wave of AI, deep learning algorithms work wellbecause of what Launchbury calls the manifold hypothesis (see below). Insimplified terms, this refers to howdifferent types of high-dimensionalnaturaldata tend to clump and be shaped differently when visualized in lower dimensions.  By mathematically manipulating and separating data clumps, deep neural networks can distinguishdifferent data types. While neural nets can achieve nuanced classification and predication capabilities, they are essentially what Launchbury calls spreadsheets on steroids.  At the recent AI By The Bay conference, Francois Chollet emphasized that deep learning is simply more powerful pattern recognition than previous statistical and machine learning methods. The most important problem for AI today is abstraction and reasoning, explains Chollet, an AI researcher at Google and famed inventor of widely used deep learning library Keras. Current supervised perception and reinforcement learning algorithms require lots of data, are terrible at planning, and are only doing straightforward pattern recognition.  By contrast, humans learn from very few examples, can do very long-term planning, and are capable of forming abstract models of a situation and [manipulating] these models to achieve extreme generalization.  Even simple human behaviors are laborious to teach to a deep learning algorithm. Lets examine a situation such as avoiding being hit by a car as you walk down the road. If you go the supervised learning route, youd need huge data sets of car situations with clearly labeled actions to take, such as stop or move. Then youd need to train a neural network to learn the mapping between the situation and the appropriate action.  If you go the reinforcement learning route, where you give an algorithm a goal and let it independently determine theideal actions to take, the computer would need to die thousands of times before learning to avoid cars in different situations.  You cannot achieve general intelligence simply by scaling up todays deep learning techniques, warns Chollet.  Humans only need to be told once to avoid cars. Were equipped with the ability to generalize from just a few examples and are capable of imagining (i.e. modeling) the dire consequences of being run over. Without losing life or limb, most of us quickly learn to avoid being overrun by motor vehicles.  While neural networks achieve statistically impressive results across large sample sizes, they are individually unreliable and often make mistakes humans would never make, such as classifying a toothbrush as a baseball bat.  Your results are only as good as your data. Neural networks fed inaccurate or incomplete data will simplyproduce the wrong results. The outcomes can be bothembarrassing and damaging.In two major PR debacles, Google Images incorrectly classified African Americans as gorillas, while Microsofts Tay learned to spew racist, misogynistichate speech after only hours training on Twitter.  Undesirable biases are implicit in our input data. Googles massive Word2Vec embeddings are built off of 3 million words from Google News. The data set makes associations such as father is to doctor as motheris to nurse, which reflect gender bias in our language. Researchers such asTolga Bolukbasi of Boston University have taken to human ratings onMechanical Turk to perform hard de-biasing to undo such associations.  Such tactics are essential since, according to Bolukbasi,word embeddings not only reflect stereotypes but can also amplify them. If the term doctor is more associated with men than women, then an algorithm might prioritize male job applicants over female job applicants for open physician positions.  Finally,Ian Goodfellow, inventor of generative adversarial networks (GANs), showed that neural networks can be deliberatelytricked with adversarial examples. By mathematically manipulating an image in a way that is undetectable to the human eye, sophisticatedattackers can trick neural networks into grossly misclassifying objects.  The dangers such adversarial attacks pose to AI systems are alarming, especially since adversarial images and original images seem identical to us. Self-driving cars could be hijacked with seemingly innocuous signage and secure systems could be compromised by data that initially appears normal.  How can we overcome the limitations of deep learning and proceed toward general artificial intelligence Chollets initial plan of attack involves using super-human pattern recognition, like deep learning, to augment explicit search and formal systems, starting with the field of mathematical proofs. Automated Theorem Provers (ATPs) typically use brute force searchand quickly hit combinatorial explosions in practical use. In the DeepMath project, Chollet and his colleagues used deep learning to assist the proof search process, simulating a mathematicians intuitions about what lemmas(a subsidiary or intermediate theorem in an argument or proof) might be relevant.  Another approach is to develop more explainable models. In handwriting recognition,neural nets currentlyneed to be trained on tens to hundreds of thousands of examples to perform decent classification. Instead of looking at just pixels, however, Launchbury of DARPA explains that generativemodels can be taught the strokes behind any given character and can use this physical construction information to disambiguate between similar numbers, such as a 9 or a 4.  Yann LeCun, inventor of convolutional neural networks (CNNs) and director of AI research at Facebook, proposes energy-based models as a method of overcoming limits in deep learning. Typically, a neural network is trained to produce a single output, such as an image label or sentence translation. LeCuns energy-based models instead give an entire set of possible outputs, such as the many ways a sentence could be translated, along with scores for each configuration.  Geoffrey Hinton, widely called the father of deep learning wants to replace neurons in neural networks with capsules that he believesmore accurately reflect the cortical structure in thehuman mind. Evolution must have found an efficient way to adapt features that are early in a sensory pathway so that they are more helpful to features that are several stages later in the pathway, Hinton explains. He hopes that capsule-based neural network architectures will be more resistant to the adversarial attacks that Goodfellow illuminated above.  Perhaps all of these approaches to overcoming the limits of deep learning have truth value. Perhaps none of them do. Only time and continued investment in AI research will tell.",2017-04-02,A new discipline called deep learning has arisen that can apply complex neural network architectures to model patterns in data more ...,Understanding the limits of deep learning,https://venturebeat.com/2017/04/02/understanding-the-limits-of-deep-learning/
18,"Its been almost two years since Google liquefied our brains with its Deep Dream neural network and the nightmare-inducing images the technology created. But now, a team from the University of California, Berkeley is sort of doing the oppositeemphasis on sort of.  The Berkeley team built a new type of deep learning software, dubbed CycleGAN, that can convert impressionist paintings into photorealistic images. With a few tweaks, the tool can also turn horses into zebras, apples into oranges, and winter into summer. Why would you ever want to do these kinds of tricks Who knows. At the very least, CycleGAN is an interesting proof of concept.  Like other deep learning techniques, the Berkeley software works by drawing relationships between two sets of common images. The primary example that the researchers discuss in their paper about the software deals with Monet paintings and landscape photography. The researchers trained CycleGAN with a set of the master impressionists paintings as well as a random batch of landscape photos pulled from Flickr, and then applied algorithms to mimic the style in either direction. The end result looks something like a photo of the landscapes Monet painted, even though weve never seen a photo of that exact landscape. Likewise, the software can take a random landscape photo and make it look like a Monet painting    The Berkeley researchers also applied the CycleGAN software to other artists work, including Cezanne, van Gogh, and Renoir. In the examples included in the paper, however, they converted photographs into painting-like images:    Perhaps obviously, the effect also works with stills from movies, including the popular and seemingly pointless live-action remake of Disneys Beauty and the Beast. Heres Belle and Gaston in the style of Renoir:  Youre probably thinking that this is just some kind of advanced Photoshop filter, and you wouldnt be completely wrong. Adobe is constantly developing new technology to make your images look crazy, like the Deep Photo Style transfer technique the company built with Cornell researchers and showed off a few days ago. That software enabled researchers to transfer attributes from one photo to another, and quite frankly, it looks pretty damn impressive:  This is all a very roundabout way of saying that the future of truth is doomed, since even a photograph can become a lie with a few keystrokes. You can even install the new Berkeley software yourself since the researchers put the code on Github. Just bear in mind it doesnt work perfectly all the time. Just look at these failures:",2017-04-03,"The Berkeley team built a new type of deep learning software, dubbed CycleGAN, that can convert impressionist paintings into photorealistic ...",Someone Finally Hijacked Deep Learning Tech to Create More ...,http://gizmodo.com/someone-finally-hijacked-deep-learning-tech-to-create-m-1793957126
