,Contents,Date,Summary,Title,URL
0,"Computers are playing spot the difference in the Serengeti. An image-recognition algorithm that can identify different species could make it easier to track animals in the wild.  Using a database of 3.2 million photos taken by hidden camera traps in the Serengeti National Park in Tanzania, Jeff Clune at the University of Wyoming in Laramie and his colleagues trained the deep-learning system to distinguish between 48 animal species, such as elephants, giraffes and gazelles. In tests, it correctly identified the species present in an image 92 per cent of the time.  Camera traps automatically take pictures of passing animals when triggered by heat and motion. This produces thousands or millions of photographs for ecologists to study, but people usually have to go through and label what each picture shows by hand, says Ali Swanson, who worked on the project while at the University of Oxford. If an algorithm could categorise at least some of the images, it could save a lot of time.  In 2010, Swanson set up 225 camera traps in the Serengeti, inviting an army of 70,000 online volunteers to help label the images. When Clune heard about this, he saw a perfect opportunity for deep learning  so he and Swanson arranged to team up on the project.  Right now in AI and deep learning, one of the hardest things to come by is a very good, large labelled dataset, says Clune.  His team started by teaching a neural network to recognise whether an image contained an animal, which 75 per cent of the Serengeti images lack. The researchers then trained it to differentiate between species.  The system is much better at identifying the most common animals in the data set, such as wildebeest, says Clune. It has trouble with more rare species like the zorilla, a type of polecat that only appears in the images a few dozen times.  Clune says the system could be used to classify most of the photographs and researchers could work on any it wasnt sure about. It could then be further trained on these hand-labelled images to get better at recognising rarer species. The team also plans to test whether the system can identify animal behaviour in images.  This is very exciting, says Chris Carbone at the Zoological Society of London. Automatic species recognition could help us learn more about the distribution of species and get a better idea of the impact humans are having on them, he says.  An ideal system would provide live tracking information about animals as they pass traps, says Swanson. But the challenge would be transmitting the data from the device in real time for the system to analyse, rather than the current method of using an SD card to store the data on the device until a researcher comes along to collect it.  One difficulty is that hyenas and elephants have a habit of damaging the cameras, which are thus kept in heavy-duty plastic cases with no space for an antenna that can transmit data. And if you do put an antenna on a camera, it wont last very long at all, says Swanson. Something will come along and chew it off pretty quick.",2017-04-11,"When Clune heard about this, he saw a perfect opportunity for deep learning – so he and Swanson arranged to team up on the project.",Deep learning tells giraffes from gazelles in the Serengeti,https://www.newscientist.com/article/2127541-deep-learning-tells-giraffes-from-gazelles-in-the-serengeti/
1,"A new deep learning method, DeepCpG, designed by researchers at EMBL-EBI, the Babraham Institute and the Sanger Institute helps scientists better understand the epigenome  the biochemical activity around the genome. Published in Genome Biology, DeepCpG leverages deep neural networks, a multi-layered machine learning model inspired by the brain. Machine learning provides a valuable tool for research into health and disease.  Deep learning is one of the most active fields in machine learning, which has led to recent advancements in computer image classification, text translation and speech recognition. But deep learning also has major potential in computational biology, particularly for regulatory genomics and cellular imaging.  Nice book. But what does it mean  We now have this amazing book of the human genome, thanks to projects like 1000 Genomes, divided up nicely into chapters and annotated in parts. But what does it mean If we want to really understand how life works, we need to decipher both the genome  the set of instructions repeated in every cell  and the epigenome, the part that varies wildly between cells, explains Oliver Stegle group leader at EMBL-EBI.  To better understand how DNA sequences relate to biological changes, the genomics community is turning to artificial neural networks  a class of machine learning methods first introduced in the 1980s and inspired by the wiring of the brain. More recently, these models have been rebranded as deep neural networks, which form the field of deep learning.  A recent review of deep learning for Molecular Systems Biology provides a user guide to how deep learning can be applied in genomics  an area of rapid technological change.  Single-cell genomics allows us to generate a huge amount of highly detailed information about the genome and all the activity happening around it, in many different types and subtypes of cells. The complexity is simply staggering, and the idea of explicitly probing each of these potential interactions individually is not really workable, says Stegle.  Most existing methods require you to know a lot up front, for example which patterns in the DNA sequence are informative for a specific task. However, there is a huge number of possible patterns in the genome that we could explore, so these existing methods are not practical for genomics, adds Christof Angermueller, PhD candidate at EMBL-EBI. With deep learning, you do not have to spend your time on manually crafting features that capture these patterns. Instead, the model uses raw DNA sequences as input and discovers relevant patters itself.  The team leveraged the capacity of deep learning to fill in the gaps in single-cell genomics, an emerging technology that offers a close-up view on epigenetics.  DeepCpG was designed to help scientists learn about the connections between DNA sequences and DNA methylation  a biochemical modification of the genome sequence that can act like an off-switch for individual genes. Methylation plays a key part in important biological processes, including cell development, ageing and cancer progression.  The new method uses genomic and epigenomic data to make predictions about DNA methylation in single cells. This is important because current technologies provide incomplete information about this. With DeepCpG, researchers can obtain a more complete picture of DNA methylation. The model can also be used to obtain new biological insights, for example on the connection between the DNA sequence and methylation.  DeepCpG actually learns meaningful features in a data-driven manner, says Angermueller. It has major advantages over previous methods, including the ability to more accurately predict DNA methylation and to study intercellular differences. By studying the wiring of the learnt network, we can understand how the biology of DNA methylation works. This has allowed us to recover known DNA sequence motifs that are important for methylation changes, as well as to discover new motifs, which are the starting point for future studies.  We have demonstrated that DeepCpG enables to accurately predict and analyse DNA methylation in single cells. However, DeepCpG is just one example of how we can apply deep learning to genomics and single-cell technologies, says Stegle. It is exciting to see the versatile applications deep learning has already found in genomics. I am looking forward to seeing more deep learning techniques come online. I believe it will make a big difference to how we study biology and has the potential to yield new answers about how life works.  Single cell epigenomics methods provide exciting insights into cell heterogeneity in development, ageing and disease; however if you are just dealing with two genomes (in a single cell) bits of information are often lost during the experiment, explains Wolf Reik of the Babraham Institute Wolf Reik of the Babraham Institute and Associate Faculty member at the Sanger Institute. This new method recognises patterns of the epigenome in single cells and then reconstructs lost information, returning a data-rich single cell epigenome.  ""Deep learning is now the state-of-the art in many fields. We are exploring its utility for making sense of large scale biological data. Pioneering studies, such as the one by Angermueller and colleagues, prove that there is lot to be gained by using deep learning methods in computational biology, concludes Leopold Parts, Group Leader at the Sanger Institute.  Angermueller, C., Lee, H., Reik, W., & Stegle, O. (2017). Accurate prediction of single-cell DNA methylation states using deep learning. bioRxiv, 055715.  ",2017-04-12,"A 'new deep learning' method, DeepCpG, designed by researchers at EMBL-EBI, the Babraham Institute and the Sanger Institute helps ...",Deep Learning: Accelerating Single-cell Genomics,https://www.technologynetworks.com/tn/news/deep-learning-tech-will-open-up-the-epigenome-287581
2,"April 11, 2017 Nimbix announced today the immediate availability of high-performance NVIDIA PascalGPUs using the NVIDIA DGX-1AI supercomputer in the Nimbix Cloud. For an on-demand rate, customers gain access to the industry-leading native bandwidth of eight NVIDIA NVLinkinterconnected NVIDIA Tesla P100 GPUs to launch or develop state-of the-art machine learning workflows, accelerated analytics and a host of other GPU-powered applications.  The Nimbix Cloud offers the most diverse set of GPU-powered machines available from a public cloud provider, spanning the NVIDIA portfolio and supporting configurations for both Intel x86 and IBM Power8 processors to deliver the best performance and economics available for both enterprises and developers. Nimbix Cloud machines are interconnected with industry-leading 56Gbps FDR and 100Gbps EDR Infiniband for optimal GPU cluster performance.  Nimbix has tremendous experience in GPU cloud computing, going all the way back to NVIDIAs Fermi architecture, said Steve Hebert, CEO of Nimbix. We are looking forward to accelerating deep learning and analytics applications for customers seeking the latest generation GPU technology available in a public cloud.  Combining the optimized performance of NVIDIA DGX-1 with Nimbixs cloud platform provides customers a flexible option to run their most challenging deep learning and AI workloads in an easy to use cloud system, said Charlie Doyle, senior director for DGX-1, NVIDIA.  In addition to the rich catalog of DGX turn-key workflows for deep learning, developers can use the PushToComputeTM feature of the JARVICE platform to import the latest versions of their custom applications into the Nimbix Cloud and make them available for consumption at scale immediately. Each application, along with its dependencies, executes in JARVICEs container runtime environment, which provides superior performance and scale. This includes sub-second launch times, faster execution, seamless access to supercomputing GPUs, automated heterogeneous data management, and rapid workflow deployment across multiple compute nodes either in a parallel or distributed paradigm. PushToComputeTM also facilitates continuous integration and continuous deployment (CI/CD) for the entire life cycles of containerized applications.  Nimbix is the leading provider of purpose-built cloud computing for machine learning, AI and HPC applications. Powered by JARVICE, the Nimbix Cloud provides high-performance software as a service, dramatically speeding up data processing for Energy, Life Sciences, Manufacturing, Media and Analytics applications. Nimbix delivers unique accelerated high-performance systems and applications from its world-class data centers as a pay-per-use service.",2017-04-11,We are looking forward to accelerating deep learning and analytics applications for customers seeking the latest generation GPU technology ...,Nimbix Cloud Adds Nvidia DGX-1 Servers for Deep Learning,https://www.hpcwire.com/off-the-wire/nimbix-announces-next-gen-gpus-cloud-based-deep-learning/
3,"Todays financial services companies must continually strive to gain a competitive edge in a highly data-intensive industry. With the emergence of big data, firms are struggling to manage the onslaught of complex data from many sources, stay on top of evolving regulations, and boost data security. High performance computing (HPC) technologies are not only helping financial firms ease the pains associated with explosive data growth, but they are also becoming absolutely essential to survival.  Emergent technologies and new HPC innovations to hit the financial sector were the focus of the 14th annual HPC on Wall Street event held earlier this week in New York City. The one-day show and conference brings together key FinTech players, financial industry experts, and capital markets IT providers to promote a discussion of the latest technological advances in the realm of financial HPC.  Each year, the show features a variety of networking opportunities, exhibits, expert panel discussions, and keynote speeches meant to help financial CIOs learn about new technologies, discuss industry trends and developments, and collaborate with experts that can help them address their biggest IT challenges.  This year, Hewlett Packard Enterprise (HPE) teamed up with SUSE and Intel to host a keynote session entitled HPC Innovation for the FSI Market. The keynote, which was delivered by Lacee McGee, Senior Product Manager for FSI Vertical Solutions at HPE and Natalia Vassilieva, a Senior Research Manager at HP Labs, as well as representatives from SUSE and Intel, concentrated on ways that financial organizations can begin their journeys into game-changing technologies like artificial intelligence (AI) and deep learning. Adoption of these emerging technologies is beginning to proliferate among companies in this sector, a fact which served as a persistent theme throughout the conference.  As McGee recently explained to EnterpriseTech, simply getting started can be the most difficult part for financial companies when it comes to implementing AI and deep learning technologies. While larger enterprises may have broader capital budgets and IT expertise, small and mid-sized businesses (SMBs) sometimes hesitate to take the plunge for a variety of reasons, including cost, lack of IT expertise, shortage of trained staff, or insufficient server infrastructure. McGees advice for SMBs was to start slow, and begin by having a trusted IT vendor package small amounts of AI and deep learning on familiar hardware. This gradual approach, meant to allow SMBs to grow with the technology and progressively increase their familiarity with these technologies, can help them ease the transition to more optimal solutions in the future.  The presentation also touched on the broadening demand for code modernization tools that can help quantitative analysts circumvent the steep learning curve associated with todays multi-core processor architectures. The HPE Quantitative Finance Library was recently introduced to address these challenges, a solution that modernizes application software using a productivity tool that generates highly parallelized source code for multi-core, multi-thread platforms. This helps quants exploit the advantages of the latest Intel Xeon Phi processors more quickly and with less time spent away from critical business activities.  Theres no denying that HPC has become essential to survival in the financial services industry. As data growth continues to bring new challenges and increased complexity to the financial services industry, HPC solutions are offering unprecedented levels of speed and efficiency, as well as whole new ways of doing business. Visit the HPC for Wall Street website for additional conference information and press coverage. You can also follow me on Twitter at @VineethRam to stay informed about the latest technologies and HPC finance innovations impacting the industry. We hope to see you at next years event!",2017-04-10,"McGee's advice for SMBs was to start slow, and begin by having a trusted IT vendor package small amounts of AI and deep learning on familiar hardware.",AI and Deep Learning Come to Wall Street,https://www.hpcwire.com/solution_content/hpe/financial-services/ai-deep-learning-come-wall-street/
4,"Japan joined the artificial intelligence race late. It was not until the mid-1980s, three decades later than countries like the United States, that researchers began pondering the idea of thinking machines. Japanese companies and universities are now increasingly pouring resources into unlocking the secrets of deep learning. The countrys slow start and scarcity of AI experts, however, has hindered progress, as illustrated by the lack of breakthroughs to date.  In March 2016 AlphaGo became the algorithm heard around the globe. In a best-of-five series in Seoul, South Korea, the go-playing program developed by Googles DeepMind soundly defeated Lee Sedol, a leading international player, 41, effectively dethroning humanity inone of the few remaining arenas where it ruled over artificial intelligence. While the ground-breaking achievement has shown a spotlight on the rapid advances in machine learning, AI is actually a rather mature concept with a long history encompassing a broad variety of technologies.  The desire to build machines with humanlike intelligence began with the accomplishments of British mathematician Alan Turing, who during World War II laid the groundwork for digital computing by developing the first electromechanical calculating device. His code-breaking machine and seminal 1947 work Intelligent Machinery inspired scientists to consider the potentials of AI. The term artificial intelligence was coined in 1956 at the pivotal Dartmouth Artificial Intelligence Conference. Japanese researchers were not among the diverse experts in attendance at that influential gathering, and it was not until 1986, three decades later, that the Japanese Society for Artificial Intelligence was formed to study AI.  Turings notions of machine intelligence encompassed such broad notions as neural networks, something I call first-generation AI. However, the JSAI was created in response to a fresh wave of debate focusing specifically on signal and information processing. More than 90% of AI researchersincluding those in Japan, where funding has steadily increasedare engaged in exploring these systems, whichI term second-generation AI. This rapidly developing field has already produced such innovations as the World Wide Web and Googles search engine.  One rapidly developing area of AI is machine learning. The idea of constructing algorithms able to analyze data and learn to make decisions and predictions based on results is not new. However, the field sat on the back burner of AI research for want of computers capable of making the necessary computations. Since the early 2000s, though, the emergence of increasingly powerful computers have enabled great strides in what is known as deep learning, making it possible to create large, multilayered artificial neural networks able to process vast amounts of data. I consider this to be third-generation AI.  While computers have improved, the lack of activity in machine learning during the 1990s has resulted in a grave shortage of experts in the field. The scarcity is particularly acute with deep learning and has forced tech giants like Alphabet (Google), Facebook, Microsoft, and Baidu to actively court and handsomely compensatesuitably capable researchers.  Japan has especially felt the pinch of the diamondlike rarity of deep learning experts. The situation is so dire, in fact, that there is hardly a domestic university or research organization with a dedicated researcher on staff.  Efforts are underway to address this paucity and a rapidly growing number of institutes are moving to offer research programs in deep learning. The problems, however, is that many of the top professors influencing the direction of programs are themselves little better than novices in the field, having spent most of their careers studying second-generation AI. In addition, views among those specializing in machine learning and deep learning frequently vary, making it difficult for institutes to decide how to best direct resources.  As a result, Japanese researchers seem stuck in neutral while their counterparts in China, Europe, and the United States rush ahead in producing a steady string of breakthroughs. My interactions with academia have left me wondering whetherthe rigid thinking at Japanese universities is promoting a derisive view of deep learning, robbing it of the serious consideration it deserves.  As an illustration, I was asked by the Ministry of Economy, Trade, and Industry to help plan two sessions on deep learning for the annual JSAI symposium in June 2016. During discussions about possible titles for the meetings, one academic quipped that no one would consider attending sessions featuring the term deep learning. As astonishing a statement as this was, it showed me the lack of regard many Japanese researchers have for cutting edge AI.  It is certainly true that deep learning represented only a small fraction of the topics covered at the symposium. One must also bear in mind that the JSAI gathering preceded Google releasing its revolutionary neural machine translation system.  Introduced in November 2016, the system foregoes standard models of natural language processing and instead uses an artificial neural network that over time learns from countless examples how to produce better translations. Although a relatively straightforward concept, the subsequent sharp improvement in the capabilities of Google Translate has left Japanese researchers gaping in awe.  In Japan the lions share of resources are directed toward studying natural language processing and machine translation. Researchers of second-generation AI have focused on unraveling the structure of intelligence with a view that it can be logically understood and recreated. As such, they have placed high value on analyzing the natural patterns of language as a means of unlocking the workings of the human mind.  The quality and accuracy of translations produced by the end-to-end approach of Googles neural machine translation system, however, have turned this method on its head. Researchers in Japan have to accept the possibility that Googles algorithm presents a revolutionary way forward or face the prospect of continuing down a dead-end road.  A similar ground-breaking dynamic can be seen behind DeepMinds approach in developing AlphaGo.  DeepMind developed the program to learn via two deep neural networks: a value network that evaluates the state of the game and a policy network that guides what actions to take. It then boosted the playing ability of the algorithm by having it study records of past matches and pitting the two networks against one other, a method it calls deep reinforcement learning.  Prior to AlphaGo, designers of go-playing AI took a fairly straightforward approach, arming programs with the rules and tactics and focusing on devising ways of winning against professionals. While significant progress was made, no AI capable of matching the wily skills of leading human players emerged.  Like a shot out of the blue, though, the relatively unknown DeepMind swooped in to claim the holy grail of computer go. Since then, leading IT companies in Japan and China like Dwango and Baidu, along with amateur programmers, have been emboldened to test their algorithms at various AI go competitions. On the other hand, Japans University of Electro-Communications shuttered its UEC Cup Computer Go tournament in the wake of AlphaGos victory, hosting the decade-old event for the final time in March 2017.  DeepMind has not grown indolent in its success but is maneuvering to take the lead globally with a string of newly developed technologies. Domestically, companies such as Yahoo Japan and Dwango, along with emerging firms like Preferred Networks, are pouring resources into deep learning. Meanwhile, major manufacturers including Toyota and FANUC are continuing to invest in AI. This is heartening to see, and I hope their efforts will net real dividends in the near future.",2017-04-11,Japanese companies and universities are now increasingly pouring resources into unlocking the secrets of deep learning. The country's slow ...,Deep Learning's Rise Leaves Japan Playing AI Catchup,http://www.nippon.com/en/currents/d00307/
