,Contents,Date,Summary,Title,URL
11,"Are you getting tired of hearing about artificial intelligence It seems we must be reaching peak hype cycle around AI when almost every article written about it rehashes the same tropes around self-driving cars, the latest game that has been mastered by computers, or the next house appliance to get speech recognition.  There is so much noise around AI that its hard to find a signal. And the real work of AI is happening behind the scenes of mainstream press coverage. After all, the places that machine learning can have the most impact havent yet been touched by AIlike automation.  But wait, I hear your moans already. Isnt artificial intelligence almost the same as automation No.  Computer automation is as old as the computer itself. The Turing Machine is by definition a self-replicating mathematical automaton. In other words, an algorithm that can automatically generate itself. But who programmed the Turing Machine to replicate itself We did.  Humans are behind the overwhelming majority of computer automation. For example, take the lowly underappreciated cron job, arguably the bedrock of computer automation. You specify a time (every five minutes) and a command (empty the trash), and the job will get done. Still, the computer didnt decide to empty the trash on its own. There was no computer sentience. You told it what to do.  But times are changing, and machine learning has opened opportunities for computers to automate and program themselves in more advanced ways than ever before.  One of the biggest macro trends in IT operations today is the movement away from humans running and managing software systems to computers running and managing software systems.  Consider one of the most successful and popular web server technologies in history: Apache. In the 1990s, the running and management of Apache was almost purely done by humans. If a server crashed, a human IT operations pro would have to fix it.  The next step forward was computer systems like Nagios, which would monitor Apache for crashes and restart it as necessary. But Nagios wasnt smart enough to get under the hood and actually manage the configuration of the software it ran.  Devops and PaaS represented the next leap, as configuration management software like Puppet and Chef could not only start and stop Apache but manage the settings as well.  Still, with devops and PaaS, the systems were being built piecemeal. If you needed to run a new application, you ad-hoc deployed it into the system. And what if the whole system crashed Could you re-create the entire thing with all of the applications and dependencies intact Not easily.  Right now, the state of the art for IT operations is declarative (as opposed to ad-hoc) systems. What do I mean by declarative I mean creating an entire IT topology that is described in a single file or set of files. Then its the declarative systems job to sync the real IT topology with the description specified in the files.  How is that different than devops or anything before Because there is no ad-hoc adding or removing from the system without modifying the declared system architecture. You dont simply deploy a few more websites or applications into the system (from the bottom up). You declare them (top-down) and let the system become consistent with your top-down declaration.  Some leaders in declarative IT include the Kubernetes project from Google and the Docker container platform. These technologies represent a paradigm shift in the operation of complex systems, but fundamentally there is still a human creating the architecture itself.  If the system needs to scale up or down, the architecture file needs to be modified to reflect that (or a human needs to specify the scaling rules).  Still, the holistic, encapsulating nature of declarative IT systems creates a new opportunity. Since the total state of the complex system is defined in a single place, the changes of state can be tracked over timebefore and after ... every improvement. Every scale up and down is logged in a centralized way.  The next step is to train a neural network on the topology and its changes over time. A recurrent neural network would then be able to predict and react to the state of the IT system based on its own assessments.  At first, the output of the learning system might be used as mere recommendations (it looks like your systems are about to be overloaded), but eventually, as the recommendations become more reliable than even human intuition, the deep learning system might take control and put all of IT management on autopilot.  We all have blind spots. Some things are so obvious to us that we cant see them. It astounds me the amount of resources that computer programmers have put into teaching computers to understand human languages when there is something so much more obvious: teaching computers to understand code itself.  If youre a programmer, youre probably rolling your eyes at this statement. After all, a compilers job is to understand and execute code. But simply following code instructions is not what I mean. I mean understanding the intentions behind code, understanding the difference between good code and bad code, intuitively being able to fix buggy code to do what it was supposed to.  Impossible Maybe, or maybe not. After all, GitHub has more than 20 million active repositories and more than 66 million pull requests. Every pull request (in theory) is a change of state from bad code to good code, from featureless code to featured code, from security vulnerable code to patched code.  The structure and volume of the data set for training a neural network on GitHub data is ideal. A recurrent neural network could be used as the ultimate code autocompletion tool. A Kohenon neural network could automatically figure out the purpose of the program you are trying to code as you write it, the ultimate code pattern identifier.  Oh, is that an abstract factory you are trying to build there You really shouldnt be doing it that way. I also noticed you are trying to build a web server. May I finish it off for you  Deep learning applied to computer programming itself is an almost completely unexplored area right now and perfectly ripe for discovery. One of the few examples of work in this direction is the bug predictor system built by Google engineers, which watches code repositories and their associated project management systems. The more frequently a piece of code shows up in a bug report, the higher the score it gets for being problematic. There is also an exponential time decay to make sure the most recent problems show up higher in the ranking. Although this isnt quite applying deep learning principles to code, it is certainly a step in that direction.  Another example is Siris successor, Viv. A Wired article includes an infographic that shows how Viv builds and executes a computer program based on the speech it receives from the user. This is very different to the way existing natural language processors work. Right now, systems like Siri and Alexa work by matching the language patterns of the request to the available set of skills. Adding new skills means adding new patterns. Once the pattern is matched, a single script is run for each pattern.  With Viv, the process resembles a more sophisticated compiler than a simple pattern matching system. In essence the human language is compiled into a set of algorithms, rather than reduced to simple patterns that can be matched to algorithms. The team at Viv seems to be creating a generic compiler for English to machine language.  The quantity of information going through IP networks is staggering. In 2013, there were around 200TB of data transferred every single minute. Today that number is almost double and growing. Ninety percent of the worlds network data has been created in the last two years.  The only way to keep up with this kind of scale is through automation. As seen in the previous examples of IT operations and the building of software itself, artificial intelligence is about to play a much more prominent role in the way our networks are managed and run.  Every action you take on the internet leaves a network fingerprint. Those fingerprints create patterns. Even encrypted traffic leaves a trail of which IP addresses were accessed at what times and with what frequency. And wherever there are patterns, artificial intelligence will eventually be able to understand them far better than humans can.  A recent Wired article covered the Darpa Cyber Grand Challenge, where AI-based hackers autonomously attacked one another and defended themselves. As you might expect, AIs can run through a cookbook of penetration testing techniques faster than their computer counterparts. The surprise was their success in finding the sorts of subtle and complex security holes that have always required human researchers to discover.  A group of network and security startups are built from the ground up to address the need to automate the discovery and patching of vulnerabilities. Among them is StackPath, a startup run by the founder of SoftLayer. Traditional security software isnt built for the age of IoT where the number of internet-connected devices is exploding.  Site licenses on a per-device basis made sense when the majority of devices were desktop computers, but with the proliferation of smartphones, laptops, pads, surfaces, and Raspberry Pis, not to mention thermostats and major appliances, the surface area for network security attacks is growing out of hand.  After all, the security of your entire network is only as good as the security of its weakest link.  The applications of machine learning to computer automation itself might be the most valuable, underused, and underhyped application of artificial intelligence to date. Why Because, more than any other use of AI, it is a force multiplier.  Using AI to assist in the running and managing of computers themselves offers improvements and opportunities to all other forms of computation, including the AI that runs our cars and powers our robo-investments. Improvements in computers playing chess arguably doesnt make a direct difference to other applications of AI, but improvements to automation do.  Thats why the next steps in the artificial intelligence revolution will be in automation.  New Tech Forum provides a venue to explore and discuss emerging enterprise technology in unprecedented depth and breadth. The selection is subjective, based on our pick of the technologies we believe to be important and of greatest interest to InfoWorld readers. InfoWorld does not accept marketing collateral for publication and reserves the right to edit all contributed content. Send all inquiries tonewtechforum@infoworld.com.",2017-03-30,Are you getting tired of hearing about artificial intelligence? It seems we must be reaching peak hype cycle around AI when almost every article ...,How deep learning will transform automation,http://www.infoworld.com/article/3184837/analytics/how-deep-learning-will-transform-automation.html
12,"Seeks boost in performance, development and affordability of AI products Last week, Intel said that it would begin collaborating with Japan based Preferred Networks (PFN) on the development of a Python-based deep learning framework to boost the performance, development and affordability of AI applications on the market.  The partnership, announced at Intels Tokyo AI Today, will focus on the companys deep learning framework called Chainer, with the results now available in Intels GitHub repository. The framework was made open source in June 2015 and has since been adopted for both research and real-world application environments. It uses Intels open source libraries (Intel Math Kernel Library and Intel Math Kernel Library Deep Neural Network) as fundamental building blocks for AI training and development.  Recently, Intel has been investing heavily in AI across several key groups  financial services, healthcare, retail, and manufacturing. As we mentioned last week, competition in the AI platform market is heating up in 2017 with key players including Intel, IBM, Qualcomm, Nvidia and AMD. Intels recent $400 million investment in buying startup Nervana Systems has contributed to the companys ability to optimize its latest Xeon and Xeon Phi processor lineups specifically for neural networks. The result is more compute density at the hardware level that allows targeted performance increases for inference tasks and machine learning workloads.  While Intel continues to remain bullish on AI, it is betting that the technology will eventually account for one of the largest workloads in corporate data centers. The nature of AI requires that training be done both at the edge and in the data center, said Chapelle. Many of our customers do not wish to share their data on the public cloud, so deep learning will still be kept on premise.  Many other multinational companies including Samsung, Google and HTC have invested heavily in AI as a means to boost the functionality of their digital voice assistant platforms for smartphones. While digital assistants are not a vertical industry that Intel has focused on, they represent a quickly growing market that enhances the intrinsic value of data but is likely bound for an eventual bubble.",2017-04-10,"The partnership, announced at Intel's Tokyo AI Today, will focus on the company's deep learning framework called Chainer, with the results ...",Intel collaborates with Preferred Networks on deep learning,http://www.fudzilla.com/news/43340-intel-collaborates-with-preferred-networks-on-deep-learning
13,"Here at The Next Platform, we tend to focus on deep learning as it relates to hardware and systems versus algorithmic innovation, but at times, it is useful to look at the co-evolution of both code and machines over time to see what might be around the next corner.  One segment of the deep learning applications area that has generated a great deal of work is in speech recognition and translationsomething weve described in detail via efforts from Baidu, Google, Tencent, among others. While the application itself is interesting, what is most notable is how codes and systems have shifted to meet the needs of new ways of thinking about some of the hardest machine learning problems. And when we stretch back to the underpinnings of machine translation and speech recognition, IBM has some of the longest historyeven if that history doesnt have a true deep learning element in relatively recently.  In his 36 years at IBM focusing on speech and language algorithms, Michael Picheny, senior manager for IBMs Watson Multimodal division (an area that focuses on language and image recognition, among other areas), much has changed for both code and the systems required to push speech recognition. While IBM, like many others doing deep learning at scale, has also landed in the large-scale deployment of GPUs for neural networks, the path to that point was long and complex. It is just in the last few years that the critical combination of advanced neural network models and the hardware to run them in real-time and at scale have been made available. And this one-two punch has shifted IBMs approach to speech algorithmic development and deployment.  Picheney says that back when he joined IBM, they were the only company doing speech analysis and recognition with statistical and computational approaches. Others were focused on physical modeling of the underlying processes in speech. They were the only ones solving the problem with compute and mathematical techniques, it was the neatest thing Id ever seen. His early speech recognition work at IBM was done on large mainframes entirely offline, an effort that was later deployed on three separate IBM minicomputers working in parallel to achieve real-time performancea first of its kind capability. Then, in the early 1980s, came the IBM PCs, which could have custom accelerators lashed on until the 1990s, when the work could be done entirely on a CPU. Speech recognition teams in Pichenys group have come full circle to accelerator cards with a reliance on GPUs, which he says are a spot-on architecture for speech, even if there are some limitations hardware-wise on the horizon for the next level of speech recognition using deep learning models.  Code-wise, much has changed for IBM when it comes to speech recognition. Picheny says that earlier systems were a combination of four componentsa feature extractor, acoustic model, language model, and speech recognition engine or decoder. As neural networks evolved, both internally and in the larger ecosystem (Caffe, TensorFlow, etc.), these components have been fused and merged, creating a master modelone that requires significant computational resources and scalability from both hardware and software. Back then, he explains that it was difficult to create an architecture that would run all of these different elements efficiently since they all had their own optimization and other features.  What we are seeing over time is that deep learning methods seem to be taking over more of the speech recognition functions. Bit by bit, deep learning structures and mechanisms are replacing older mechanisms that made it harder to do the heavy duty scaling. In the next couple of years, perhaps longer, we will see deep learning architectures used for all components of speech recognitionand image as well.  He notes that over time too, it might be possible for these many functions to be packaged into a single special purpose chip to make it even easier to scale.  People working in deep learning have become very agile in what theyve learned to do. The field is moving so fast; there are advances in one framework, another in a different oneall of the deep learning packages have their pros and cons, especially for speechWeve worked with all the major packages, some are better than others, but I dont want to say which. But we also have built a good bit of our own code, Picheny says.  For speech, IBM has its own custom-developed neural network models that feed into Watson (which is still a nebulous thing hardware and software-wise, were still working on that story), For these models, the drivers are computation speed and memory. As it turns out, these are the biggest limitations as well, particularly on the memory front.  GPUs are very fast but limited in memory. Thats where the bottleneck is for training on huge quantities of speech. Theres advantage in keeping everything on local memory on the GPU versus fetching it off the chip. And there are algorithms where people are trying to combine results across multiple GPUs, which means making performance tradeoffs for that level of parallelization. What we really want are faster GPUs with more memory.  Aside from custom ASICs just for speech, we asked Picheny about other architectures that seem to be getting traction in deep learning outside of pure-play deep learning chips from companies like Nervana Systems (now part of Intel). One of the likely candidates for speech acceleration could be neuromorphic devicesand IBM has developed its own (TrueNorth). There is a lot of work on neuromorphic architectures but the limitation of these chips, even though they do fascinating things, is that you have to program them far differently than a GPU. And with a GPU there are big communities of people writing special purpose libraries. The limitation is that the people developing their algorithms dont want a new way of programming what theyre already doing.  FPGAs have a similar problem, Picheny says, but are more of an intermediate solution, but programming is still not easy. He says the availability of a rich array of libraries in the GPU CUDA ecosystem is the reason deep learning will continue to be done on GPUs in this middle period before we might see specialized chips just for this task.  On the note above about Watson being nebulous: Pichney agrees that it is hard to pin down just how many different frameworks and models are part of Watsons overall AI umbrella, but this is not by design. Everything is evolving so quickly, especially in the last two years. He says that what Watson was in the beginning, just as with his own speech recognition algorithms and clusters, isnt the same now. While we might not get answers from IBM about just how many components Watson encapsulates and what hardware is required to make it all work for key applications, one can image that Pichenys story about the merging and fusing of various components into master networks with specialized functionality might ring equally true for Watson.",2017-04-07,"Here at The Next Platform, we tend to focus on deep learning as it relates to hardware and systems versus algorithmic innovation, but at times, ...",From Mainframes to Deep Learning Clusters: IBM's Speech Journey,https://www.nextplatform.com/2017/04/07/mainframes-deep-learning-clusters-ibms-speech-journey/
14,"If brands and marketers want to get the right message to the right customer at the right time, they need to prepare  Take for instance, the tired marketing mantra of getting the right message to the right customer at the right time.  While that's long been a goal of marketers, Brandon Purcell, a senior analyst at Forrester, said at Forrester's AI Summit in New York yesterday that the the traditional marketing machine was only capable of identifying the right customer and right time, not the right message.  There is something, however, that could make this into reality. Deep learning, according to Purcell, is a fast evolving set of technologies and algorithms used by researchers, data scientists, and/or developers to build, train and test artificial neural networks that can be used as predictive models to probabilistically predict outcomes and/or identify complex patterns in data.  Quite simply, deep learning is the marketing red pill. And with deep learning, Purcell says, brands and marketers should use these AI-marketing innovations to deliver the right message.  Well, deep learning is used to unlock insight from unstructured data, such as image and video analytics, speech analytics, facial recognition, and text analytics. It's these capabilities, Purcell believes, that will change the way brands interact with consumers in the future.  Deep learning will eventually help automate and optimize the entire customer journey, said Purcell. For marketers, AI will fulfill the promise of customer analytics, giving brands and marketers the ability to get the right message to the right customer at the right time.  Purcell highlighted that certain platforms, such as deep learning and machine learning, will give marketers the ability to train their own machine to learn algorithms from scratch. However, if marketers and brands, were more interested in preparing with an automatic approach with a fully-baked AI solution, Purcell spoke about the following platforms and their strengths:  Of course, Purcell cautioned, the models are only as good as the data, so it's better to be aware and prepared of these changes, if brands and marketers want to get the right message to the right customer at the right time.",2017-04-06,"Well, deep learning is used to unlock insight from unstructured data, such as image and video analytics, speech analytics, facial recognition, ...",How Deep Learning Will Disrupt Marketing,http://www.dmnews.com/marketing-strategy/how-deep-learning-will-disrupt-marketing/article/649067/
