,Unnamed: 0,Contents,Date,Summary,Title,URL,lemma,stemm,token
33,39,"An innovative robotic system that can clean building exteriors using water jets or give new coats of paint is now ready to serve customers in Singapore.  It is co-developed by local pioneer in automated controls and biometric contactless systems ELID Technology International and Nanyang Technological University, Singapore (NTU Singapore), ranked 4th globally for Engineering & Technology in the recent Quacquarelli Symonds (QS) World University Rankings by Subject 2017.  Named OutoBot, this patent-pending automation is locally built and will improve productivity while enhancing workplace safety. It needs only half the manpower to run and can work for longer hours as compared to manual methods.  For the washing or painting of a building faade, a team of five is usually required - two on the ground and roof top, with three cleaners or painters on the gondola.  Instead, Outobot requires only two workers - one operator on the ground and one as a safety officer.  It has a robotic arm equipped with a camera and a spray nozzle that can shoot high-pressure water jets to clean surfaces or to spray paint. No painters or cleaners are required to be on the system's specially built gondola.  ELID's first innovation in robotic automation was envisaged in response to the Housing & Development Board (HDB) call for proposals to automate the painting of external HDB building faades, so as to enhance worker safety and increase productivity.  Managing Director of ELID Technology International, Mr Dennis Lim, who first came up with an idea of the robotic system, said it would tackle productivity issues for painting buildings in line with Singapore's Smart Nation vision.  ""With Singapore's rapidly aging workforce, we need to find ways to enable our employees to continue contributing despite their advanced years,"" Mr Lim explained.  ""Using our new robot, we have shown that a labour-intensive job can transformed into one that can be easily done by an older worker, and at the same time eliminating the risk of employees having to work at heights,"" added Mr Lim.  Professor Chen I-Ming, Director of the NTU Robotic Research Centre who jointly led the development of OutoBot, said the project is an example of how the university leverages its engineering expertise to improve productivity, while enhancing worker safety.  ""Our aim is to make the cleaning and painting of high-rise buildings easier, safer and more cost-effective,"" explained Prof Chen, who teaches at NTU's School of Mechanical and Aerospace Engineering. ""By using spray painting over conventional roller painting, our robot is also more precise and efficient, minimising waste and saving paint.""  ""To tackle Singapore's manpower challenges, NTU has a strong research focus on robotics, which is set to fill an important gap in the productivity and automation needs of the industry. We can now do more with less manpower.""  OutoBot comprises of a robotic arm with six-degrees of freedom mounted on a specially designed automated gondola and weighs under 500 kilogrammes.  Powered by a conventional power outlet, the robot can scan the exterior surface of a building using a camera and automatically plot the areas to spray paint or clean while avoiding the windows. It also gives a more consistent coat of paint as compared to the manual methods.  Apart from saving up to 50 per cent manpower requirements, it can speed up both the cleaning and painting process by about 30 per cent since it does not need a break. The automated system also minimises wastage, saving up to 20 per cent of paint.  To speed up the process at the same building, multiple systems can be deployed.  Next phase: Trials in industrial and residential areas  The made-in-Singapore OutoBot is now patent pending and has been put through its paces at an industrial building located at Ubi, in the eastern part of Singapore. It is now ready and will be deployed for an upcoming project over the next few months. It will also be tested on selected public housing blocks, in consultation with HDB. Through the trials, HDB will work with ELID to refine or customise the robot's design to better suit its building designs and facades.  ELID, together with NTU's innovation and enterprise arm NTUitive, are now in talks with other companies as well as government agencies to deploy the robot at other suitable commercial and residential properties.  A research-intensive public university, Nanyang Technological University, Singapore (NTU Singapore) has 33,500 undergraduate and postgraduate students in the colleges of Engineering, Business, Science, Humanities, Arts, & Social Sciences, and its Interdisciplinary Graduate School. It also has a medical school, the Lee Kong Chian School of Medicine, set up jointly with Imperial College London.  NTU is also home to world-class autonomous institutes - the National Institute of Education, S Rajaratnam School of International Studies, Earth Observatory of Singapore, and Singapore Centre for Environmental Life Sciences Engineering - and various leading research centres such as the Nanyang Environment & Water Research Institute (NEWRI), Energy Research Institute @ NTU (ERI@N) and the Institute on Asian Consumer Insight (ACI).  Ranked 13th in the world, NTU has also been ranked the world's top young university for the last three years running. The University's main campus has been named one of the Top 15 Most Beautiful in the World. NTU also has a campus in Novena, Singapore's medical district.",2017-03-15,"To tackle Singapore's manpower challenges, NTU has a strong research focus on robotics, which is set to fill an important gap in the ...",NTU Singapore and ELID Technology develop robot to wash and ...,https://www.eurekalert.org/pub_releases/2017-03/ntu-nsa031517.php,0,2,8
34,40,"Traditionally, robots sit in the factory within a finite space and with fixed rules, a safe distance away from its human operators. Today, the capabilities of robots have grown and humans and robots can almost work hand in hand. This may have resulted in the fear of robots for taking over jobs or the loss of the ""human touch"".  Against the backdrop of the tightening labour market and rising manpower costs, adopting robotic technology could potentially boost productivity, in addition to strengthening competitiveness and generating growth, whilst retaining staff employment. Studies have shown that robotics and automation have made a positive net effect on labour demand in the Europe and United States regions1.  Robotics has been identified as a growth sector in the international marketplace. Having a headstart in building competitive and differentiated robotics ecosystem may prove to be beneficial. According to the International Federation of Robotics Statistical Analysis and EU Roadmap 2013, the global robotics industry is projected to grow from US$20b today to US$80b by 2025.  China, already the global leader in the robotics sales market, will continue their quest at adopting robotics, targetting to achieve a robot density of 150 units by 2020. The Republic of Korea and Japan are hot on the heels of China2. Japan, already a known robotics powerhouse, has plans to triple its spending on intelligent machines to 2.4t yen by 20203. Robotics is also one of the pillars of Singapores future economy, with strong government support in the form of the National Robotics Programme.  The path to adopting robotics  starting with cobotisation   The path to adopting robotics has to be a well-planned one, and a good starting point would be to redesign work spaces to allow for an inclusive workplace where humans and robots can work together in a collaborative and mutually reinforcing way  cobotisation.  It is possible for a degree of artificial intelligence, perhaps a form of ambient intelligence, in robotic technologies to create effective engagements between man and machine. With the current advancements in sensor technology, visual analytics, and machine learning, robots are emerging as a viable working mate in both traditional settings and for new applications across industries.  At Tung Lok Group, it takes only two chefs to operate a cooking robot that can prepare up to 60kg of food. Smarter robotic arms are being developed to ensure safety and to minimise errors and wastage, monitored by technically-savvy human controllers. Small business owners such as toys and jewellery makers can also save time by automating some of their processes with automated 3D printers. The possibilities of robotics assisting humans are endless.  Getting ready for the change   Like any form of transformation, stakeholders would have to understand the business' stance and embrace the shift towards cobotisation. Business owners, especially small and medium enterprises (SMEs), must take the first step in understanding how robotics technologies can help their business stay competitive and look into the potential funding opportunities to ease them into the path of robotic technology adoption.  Small businesses can also participate in incubator programmes or training workshops established by industry leaders. ABB's Regional Robotics Packaging Application Hub features demo units to allow customers, partners, and ABB to run trials with actual products, assemble robotics systems, and run tests. Such innovation platforms benefit the emerging companies and are good best practices that could be adopted to fit their needs.  Before taking the plunge into the drive for robotics and automation, employers should start redesigning jobs and equip employees with new skills to prepare them for the shift towards cobotisation. They could also tap on funding and re-skilling opportunities available through the government or industry associations. In Singapore, we have the National Robotics Programme, which pledged $450m to help companies apply robotics and automation solutions.  Industry support is key   The transformation of the business should also be supported by the government agencies and industry associations.  Organisations such as SPRING Singapore has already taken steps to encourage more enterprises to adopt digital and automation solutions with its recently launched industry-specific roadmap. By partnering the Workforce Singapore to re-skill labour, the agencies will ensure a holistic transition, starting with the food services and retail industry.  The success of the first VendCaf, a food vending machine, is a prime example of the possibility of shifting towards robotics and automation. It not only requires 70% to 90% less manpower, but is also available 24/7 to consumers. There are already plans to launch more of such machines around the country.  1Study of Mannheim Centre for European Economic Research (ZEW) and the University of Utrecht, 2016; and World Robotics Report 2016. Source: http://www.ifr.org/news/ifr-press-release/world-robotics-report-2016-832/   2World Robotics Report, 2016.   3Announced by the Japanese Prime Minister Shinzo Abe at the Japans Robot Revolution Initiative Council on May 15, 2015. Source: http://www.bloomberg.com/news/articles/2015-05-28/japan-unleashes-a-robo...",2016-12-11,"Against the backdrop of the tightening labour market and rising manpower costs, adopting robotic technology could potentially boost ...",Cobotisation – the solution to Industry 4.0 in Singapore,http://sbr.com.sg/information-technology/commentary/cobotisation-%E2%80%93-solution-industry-40-in-singapore,6,8,2
35,42,"SINGAPORE - Drivers headed to the Central Business District may have a robot as their next valet. By the end of the next year (2018), the redeveloped Robinson Towers will feature a new automated system that makes use of robots to park cars.  Guided by lasers, cameras, as well as markings on the ground, the robots will ferry cars - with a maximum weight of 2,600kg - from a drop-off point to the nearest available parking space.  Developed by engineering firm MHE-Demag, it is believed to be the first application of the technology in Singapore.  Unlike other mechanised parking systems the system does not require steel supporting structures or parking pallets, said MHE-Demag sales and markets regional director Klaus Schilling. Parking pallets are platforms on which cars are placed on before moving them.  ""No additional building provision is required for the system and it can be adapted into a conventional parking provision in any building development easily,"" he said.  The parking fee will be ""similar"" to other carparks, he added.  At CapitaGreen, across the road from Robinson Towers, it costs $3.10 per half hour to park between 7am and 6pm on weekdays.  Conventional mechanised parking systems - which use mechanical car lifters to carry a car to a storage space - can be found at several locations in Singapore, including three Housing Board car parks at Changi Village, Yishun and Bukit Panjang.  During peak periods, retrieving a car from these carparks can take about 10 to 15 minutes.  MHE-Demag's system offers ""relatively faster"" parking and retrieval times, said Mr Schilling, adding that the average time to retrieve a car - which is done using a mobile app - will be about two minutes.  The firm is also looking at introducing the technology at ""several other locations"", which it did not disclose. It has also started to introduce the technology in other countries in the region including Malaysia and Indonesia.  While the firm declined to say how much the system will cost, a similar system by Chinese firm Yee Fung Automation - introduced in Nanjing, China in December last year - is said to cost around $200,000.",2017-02-06,"Robinson Towers to feature robotic parking by 2018 ... firm MHE-Demag, it is believed to be the first application of the technology in Singapore.",Robinson Towers to feature robotic parking by 2018,http://www.straitstimes.com/singapore/robinson-towers-to-feature-robotic-parking-by-2018,3,1,4
36,43,"Nadine, a robot receptionist at the Nanyang Technological University (NTU), is staring at the visitor in front of her. ""I remember you,"" she says. ""You were here last Saturday.""  The long-haired, uncannily human-looking robot pauses as her software runs through past interactions to figure out the most appropriate thing to say. Finally, she settles on: ""We talked about your job.""  At the National University of Singapore campus, a driverless cart attempts to navigate along a crowded walkway. When it senses a person in front of it, it stops; and as the crowd disperses, it inches forward, having learnt when to stop when an obstacle impedes its progress and when it is safe to move again.  These are two of the latest artificial intelligence (AI) projects that local researchers are working on as Singapore positions itself to grab a piece of the global market tipped to reach US$5.05 billion (S$6.8 billion) by 2020.  The revenue prediction by India- based research and consulting firm MarketsandMarkets was based on an expected rise in the adoption of AI in media and advertising, retail, finance and healthcare, growing from a market size of US$419.7 million in 2014.  The new wave of AI machines like Nadine has moved beyond traditional AI design, in which machines are given specific instructions to follow with no room for improvisation.  Rather, they tap into a subfield of AI, called machine learning, in which machines generate new outcomes for themselves after learning from previous outcomes.  ""Nadine could eventually act as a robotic caretaker for the sick or elderly,"" said NTU's Professor Nadia Thalmann, Nadine's creator.  Machine learning was thrust into the spotlight last month when a computer program, AlphaGo, beat one of the highest-ranking players in the world 4-1 in the ancient, complex board game of Go.  Such a feat was thought to be at least five years away, and would not have been possible without machine learning. It would have been impossible to code all the optimal moves into the software as the number of moves on the evolving board state can exceed the number of atoms in the universe.  However, AlphaGo's developer company, DeepMind, fed the software millions of Go games and had it play against itself, where it eventually learnt and developed a play style of its own. AlphaGo's success brought renewed interest in the capabilities of machine learning.  While both AI and machine learning are not new, they have become more accessible to software developers due to two recent factors: the rapid increase in computational power and the proliferation of big data.  ""These two advances in computing technology made it possible for computers to efficiently crunch large amounts of data to look for patterns, and to have a wide dataset to learn from,"" said Associate Professor Steven Hoi, an expert in machine learning from the Singapore Management University.  Consumers are seeing the applications of machine learning in the smart devices in their hands. Speech-recognition software like Apple's Siri and Microsoft's Cortana, for instance, make use of machine learning to comprehend a user's voice and the spoken instructions to the phone via a process called natural language processing.  Machine learning also underlies many of Google's services found in Android devices. Google Photos, for instance, uses machine learning to learn and tag objects in its gallery.  When a user searches for ""cats"", for example, the app is able to pick out photos with cats in them, having learnt how to identify such felines through millions of examples.  According to Professor Alfred Huan, executive director of the Agency for Science, Technology and Research's (A*Star) Institute of High Performance Computing, current capabilities of AI have reached near human-level performance in areas such as machine vision and speech recognition.  But while machine learning has enabled AI to leap ever closer to the ambitious goal of simulating human consciousness, experts say there is still a long way to go before the days of robotic superiority.  ""As impressive as these feats have been, machines are still nowhere near the intelligence of even a two-year-old child,"" said Prof Huan. ""We are still far away from any truly intelligent machine capable of replacing humans.""  Machine learning is a subset of the field of computer science known as artificial intelligence (AI), which seeks to simulate the workings of a human brain.  Machine learning is a form of programming, where the software improves its response after learning from previous responses, rather than following only scripted responses.  Nascent forms of machine learning first emerged some 20 years ago. The most modern form is ""deep learning"", which tries to model the neural networks of the human brain by identifying millions of patterns in large datasets to predict the next outcome.  It plays an important role in big data analytics and is currently the rage in machine-learning research, given the accessibility of big data and computational power.  Professor Lee Wee Sun, vice-dean of undergraduate studies at the National University of Singapore's School of Computing, says ""true"" AI is still far off in the future because there are four requirements for software before it can be deemed ""intelligent"": learning, planning, reasoning and knowledge representation.  So, while machines may currently be able to crunch large amounts of data and make accurate decisions, such as when to buy and sell in the stock market based on statistical predictions, the human mind may never be replaced in areas like artistic creativity or coming up with novel solutions to open-ended problems.",2016-04-19,"Nadine, a robot receptionist at the Nanyang Technological University (NTU), is staring at the visitor in front of her. I remember you, she says.","Robot receptionist, driverless cart: Singapore eyes a slice of the ...",http://www.straitstimes.com/tech/robot-receptionist-driverless-cart-singapore-eyes-a-slice-of-the-artificial-intelligence-pie,1,8,2
37,44,"Your future home might be planned using virtual reality, built with a 3D printer and inspected by a robot for quality.  What may sound like a sci-fi movie could become reality in a few decades as Singapore ramps up its construction productivity and employs more efficient building methods.  Construction site productivity has grown by an average rate of 1.3 per cent per year since 2009 but there is still room for improvement, said National Development Minister Lawrence Wong yesterday at the launch of the Singapore Construction Productivity Week at the Singapore Expo.  As such, the Government is adopting a string of measures to raise productivity growth to the national target of 3 per cent per year.  This comes amid a need to overcome manpower constraints as Singapore continues to develop and take on more construction projects, such as the upcoming Jurong Lake District and waterfront city at Tanjong Pagar, Mr Wong said.  The Building and Construction Authority (BCA) has come up with a new road map that will see the industry develop, adapt and adopt technologies in areas such as robotics, 3D printing and prefabrication in factories.  Such methods, some of which are already in practice here, are expected to speed up the building process, rely on fewer workers and boost construction quality.  About 400 industry players, public agencies, institutes of higher learning and research institutions were consulted for this road map.  ""BCA will now study how we can support these different research priorities and give them a greater push,"" said Mr Wong.  BCA chief executive John Keung said the first step is to look for funding for such technologies, which are typically more expensive. But he is not too worried about cost.  Said Dr Keung: ""Once the industry is familiar with (such technologies), there will be economies of scale... and the cost will come down.""  Some of these technologies were on show yesterday at the event's BuildTech Asia exhibition, organised by Sphere Exhibits and hosted by BCA.  Nanyang Technological University's Singapore Centre for 3D Printing, for instance, showcased a 3D printer that can produce concrete structures.  The Government will also look at stipulating productivity outcomes, such as manpower savings, for future Government Land Sales (GLS) sites, but without mandating any specific technology.  Currently, the use of specific technologies, such as prefabricated pre-finished volumetric construction, has been mandated for selected GLS sites.  But the new requirement will allow ""more innovation and scope"" for firms bidding for the sites to come up with their own productive methods, said Dr Keung.",2016-10-18,"Nanyang Technological University's Singapore Centre for 3D Printing, for instance, showcased a 3D printer that can produce concrete ...",Use robot to check buildings in quality test?,http://news.asiaone.com/news/singapore/use-robot-check-buildings-quality-test,5,2,2
