,Unnamed: 0,Contents,Date,Summary,Title,URL,lemma,stemm,token
59,69,"Looking out of the window of his 15-storey HDB flat, businessman and father-of-two Alex Chin marvels at the scene before him.  Thirteen years ago, when he was 20, this flat located at Tengah, a former military training area in Singapore's west and ringed by a 100m-wide, 5km-long forest corridor, did not exist.  But if it did, he would have been looking out over a typical multistorey HDB carpark, full of a mix of sedans, SUVs, motorbikes, vans and pick-up trucks. Gantry bars would be rising and falling as the electronic parking system deducted payment from in-vehicle units.  Elderly residents would be making their way painstakingly across the road to get to the coffee shop for a bite.  Children would be getting off the bus from school.  Foreign workers might be yelling as they gesticulated to a rubbish truck backing up to a communal rubbish chute.  Now, there are far fewer parking spaces available, with land being set aside for other uses. In fact, the town centre at Tengah - Singapore's 24th HDB town - is entirely car-free, with an underground network of roads serving public buses and other vehicles.  Besides, technology has made cars with drivers redundant. Self-driving vehicles have proliferated in the form of taxi services and commercial vehicles transporting goods and freight to logistics centres from Changi East and the Tuas mega port - to which Singapore has been moving its port activities from Tanjong Pagar and Pasir Panjang.  There are also far fewer foreign workers collecting rubbish, thanks to an underground pneumatic waste collection system that collects all the rubbish that residents throw down the chutes and transports it by underground pipes to a centralised bin. The trash is later transported to incineration plants.  As he looks onto Tengah Reservoir in the distance, Alex sees a large, dark patch on the still waters. These solar photovoltaic systems, placed on floating platforms, are now a feature in every reservoir islandwide, providing clean energy to power Singapore's electric grid.  Hunger pangs remind Alex that it is time for dinner. He orders nasi briyani and rojak, which will be delivered to his block by drones.  He goes to the bedroom and urges his seven-year-old daughter to finish her online maths assignment from school.  Shortly later, his wife Priyanka returns to their flat. The 32-year-old data analyst has just commuted back via high-speed rail after a work trip to Kuala Lumpur.  They chat over dinner about what to do when they next have time off. She suggests Orchard Road, because while they can buy anything online from anywhere, there's that old-school buzz of seeing physical merchandise and being part of a happy crowd doing the perennial Singapore pastime of shopping.  The popular shopping belt has undergone a major revamp - a section has been entirely pedestrianised, there is a plethora of boutique shops selling local wares and there is a theme park that attracts tourists and shoppers alike.  Like Orchard Road, much else in Singapore has changed over the span of 13 years.  The Jurong Lake District has morphed into Singapore's second central business district, a transformation sparked by the 350km high-speed rail line linking Jurong East to Kuala Lumpur.  Pavements in the area are wide, and friendly to both pedestrians and cyclists. A bicycle-sharing system makes it easy for tourists to explore the area, while electric feeder buses ply the estate.  Unforeseen new technologies and companies have also emerged to disrupt industries and lifestyles, just how Uber and Airbnb did in the previous decade.  HOW IT CAME ABOUT  For Alex, 2017 was a milestone year as that was when a high-powered committee released a report that helped change the course of his career.  Back then, he was 20, had done his national service, and was taking the tried and true route that had the approval of his parents - studying accountancy. But then the Committee on the Future Economy report came out and his plan that would have seen him in a safe white-collar job seemed ill-equipped for a challenging future.  He realised that if he could combine the IT skills he had picked up out of interest with his awareness of robotics and his practical skills with numbers, he could start his own business based on his interests. He withdrew from his accounting programme and switched to reading biomedical engineering.  The Government was making it much easier to start a business by easing regulations to make it easier for start-ups to get funding from venture capital firms and providing more support for enterprises venturing overseas.  Society was also changing - risk-taking was encouraged and no longer so scary.  The education system was also shifting tack, helping children to find their own path among all the opportunities now laid out. The priority was shifting from academic excellence to picking up practical and soft skills, as well as taking on board the need for lifelong learning.  True, his parents were stuck in the old ways of thinking, being fixated on academic grades and opting for safe career choices like accounting and finance.  But look at his father - this safe way was no longer so safe. He had been made redundant twice from his job as a bank manager, but was looking at getting new skills to remain employable.  Anyway, at that age of 20, Alex had read the signs. Entrepreneurship was the way to go. If he could think of a product, develop it, make use of the grants available, the shared knowledge from peers and the hook-ups from government agencies, he could develop a home-grown business.  More than that, he could grow it beyond Singapore. The CFE report had signalled to him that the world was his oyster - make that, rice bowl.  So five years on found him having founded a company to manufacture components for robotic surgery systems.  His then-fledgling business received a boost in 2023, when it was awarded a contract to supply Singapore's Health Ministry with mechanical parts for robot-assisted surgery. That helped him develop a track record and paved the way for him to expand into Cambodia, Indonesia, Malaysia and Laos - members of the Asean Economic Community and the Free Trade Area of the Asia-Pacific.  He also received customised support and funding from IE Singapore to expand his business, which is headquartered in the Jurong Innovation District. The 600ha industrial park houses learning, research, innovation and production activities.  Entrepreneurs like Alex who have ventured into Singapore's regional hinterland have been critical to maintaining the country's growth.  Through a combination of remaining open to trade and investment, nurturing growth industries and equipping its workforce with deep skills, Singapore has managed to maintain growth of around 2 to 3 per cent each year, while its population increased to 6.9 million. It has remained open to foreign talent, even as it raised the criteria for employment pass applications. Manufacturing still accounts for close to 20 per cent of GDP.  These results have defied the expectations of observers who panned the CFE report for being too general, uninspiring and a rehash of old strategies when it was released 13 years ago.  Some attribute the good results to the Government and Singaporeans taking heed of the recommendations laid out, from focusing on skills above grades to remaining open to trade.  Another factor behind growth is the emergence of the digital economy, with more Singaporeans opting for careers in the data and cybersecurity industries.  When she isn't commuting to KL for work, Priyanka is based in Punggol, which has become a cluster for businesses in the digital, infocomm technology and cybersecurity fields.  The 32-year-old too, had taken the cue from the CFE report about how the digital economy was set to flourish. She thus opted to read data science in polytechnic and at university.  Alex wonders if their four-year-old son Elon will eventually work in the digital sector. That could happen, he thinks, if his son is posted to a vocation where he gets to learn cybersecurity skills during national service.  The number of career cybersecurity specialists has gone up, after the Ministry of Defence created new technology vocations within the Singapore Armed Forces to equip national servicemen with cyber warfare skills.  Alex pictures his son sitting in front of a computer terminal, learning how to write programs to counter malicious computer software - that would be a far cry from his own national service when he was a tank driver, he thinks.  The structural shifts in the economy have forced many to skill up or be left behind.  Priyanka's father, Mr Arjun Chikkarangappa, 59, had driven a prime mover transporting cargo around Tanjong Pagar Terminal for more than 20 years.  But when operations at Tanjong Pagar moved to the Tuas mega port in Tuas South, he found that automated guided vehicles had made his old job redundant.  The new Tuas mega-terminal - meant to be a showcase of new technologies that would boost productivity and reduce the reliance on manpower - was outfitted with automated yard cranes and self-driving vehicles that transported cargo.  Reluctant to give up working in the only industry he has known, Mr Chikkarangappa went for training to learn how to do basic programming for the automated vehicles.  An Industry Transformation Map for sea transport, coordinated by the Maritime and Port Authority of Singapore, had highlighted the importance of helping older port workers reskill.  For Alex, constantly learning new skills and keeping abreast of new technologies has become essential.  As he whips out his hipster-retro iPhone 10 to book a self-driving Uber to the new Terminal 5 at Changi Airport for a work trip, he thinks about how the increased government support has made it much easier for businessmen like him to venture abroad.  The country has also evolved from just being a key site for companies' regional and corporate headquarters to a ""runway economy"" where new ideas can develop, and eventually take off.  As his plane leaves Singapore's third airport runway, he realises people like him have indeed become pioneers for the next generation - just as the CFE report urged.",2017-02-18,"What would the Singapore of tomorrow be like for an HDB household, ... Besides, technology has made cars with drivers redundant. ... to supply Singapore's Health Ministry with mechanical parts for robot-assisted surgery.",Imagining the future: What would Singapore be like in 2030,http://www.straitstimes.com/politics/imagining-the-future,7,0,0
60,71,"Automation could replace many jobs in the region in the coming years but such technological advances will also make it even harder for local firms to find high-skilled staff to operate the new equipment, according to a new report.  One way to meet this need is to encourage students to focus on so-called Stem subjects - science, technology, engineering and mathematics, according to the report by the International Labour Organisation (ILO) yesterday.  ""Despite significant indications of innovation and technological progress, enterprises in Singapore reported that costs and skills are the biggest barriers to upgrading technology, with lack of skills reported more frequently in Singapore than on average in Asean,"" the report said.  Singapore accounts for half of Asean's ""high-skill, technology-intensive"" manufacturing exports, followed by Thailand (19.6 per cent) and Malaysia (15.7 per cent).  The ILO also found that 56 per cent of the salaried workforce from Cambodia, Indonesia, the Philippines, Thailand and Vietnam are at ""high risk"" of being displaced by technology in the next decade or two, with workers in the garments industry the most vulnerable.  The ILO surveyed 4,076 regional enterprises across the manufacturing and service sectors, including 301 from Singapore, as well as students from over 2,700 universities and vocational colleges, including 206 from Singapore.  Firms here named rising labour costs as the biggest threat they face over the coming decade.  The United Nations agency noted that the Singapore Government has taken steps to use new technology to deal with the skills shortage and mitigate rising labour costs. Earlier this year, for example, the Government earmarked over $450 million to expand the National Robotics Programme over the next three years.  ""Increased automation will also create considerable high-skilled work, as optimised robots and machinery will need capable technicians and engineers,"" the ILO noted.  It also warned that workers here ""are not immune to rising skills needs brought on by technology, and students need to be encouraged to focus on Stem subjects to meet the future needs of enterprises in Singapore"".  But the problem is more complex than that, argued CIMB Private Banking economist Song Seng Wun.  ""Even though we push students to go for engineering courses, maybe only one out of 10 ends up doing what they did in school. The rest move to a more lucrative sector like financial services,"" he said.  ""So it's a bread-and-butter issue, and closing that pay gap is where the difficulty lies. Either pay comes down on the financial services side, or employers on the engineering side push up wages to attract and retain talent.  ""This has been the challenge for the longest of times.""",2016-07-07,A robot delivering food at Rong Heng Seafood restaurant. The ILO noted Singapore's efforts to use technology to deal with the skills shortage ...,"Yes, robots may steal your job...",http://www.straitstimes.com/business/yes-robots-may-steal-your-job,5,0,2
61,72,"Dyson is expanding its footprint in Singapore, with a new Technology Centre opened today by the maker of vacuums and other smart home electronics. The UK company will be investing $561 million as part of its commitment to the new facility, which hosts working labs where research and development teams can pool their cumulative hardware and software know-how to help advance the companys growing ambitions.  If youre only passingly familiar with Dysons work, you might be wondering what a company that makes vacuums needs with a half-million dollar tech facility with a focus the company says is on artificial intelligence, machine learning and software development. But Dyson has always emphasized its tech edge in the domestic cleaning hardware market, and its only doing more to push that advantage lately, including more work in robotics, computer visions systems and machine learning with products like its Dyson 360 Eye robot vacuum.  As you can see from the photos of the facility, the company also put a lot of engineering work into one of its most recent products, the Supersonic hair dryer. There has also been some speculation that Dyson could extend some of its expertise around electric motors and battery tech into the automotive space, though the company isnt saying much one way or another about those reports just yet.  Dysons new facility also includes what they call The Control Tower, which shows real-time supply chain and logistics data, and which they use to help ensure things run smoothly in terms of global production and shipping, and the new tech centre is very close to Dysons West Park production facility, where the company says one of its digital motors leaves the line every 2.6 seconds, thanks to highly automated production lines.  Dyson has already said that it will do much more in robotics, machine learning and robotics according to the engineer leading its robotics program, Mike Aldred, and it seems like this new tech center will help with those pursuits. The company has already admitted its working on next-generation robot vacuums, even as it launched the first, and it also says that computer vision and other tech it created for the 360 Eye will apply more broadly across its offerings.",2017-02-13,Dyson opens new Singapore tech center with focus on R&D in AI and software ... learning with products like its Dyson 360 Eye robot vacuum.,Dyson opens new Singapore tech center with focus on R&D in AI ...,https://techcrunch.com/2017/02/13/dyson-opens-new-singapore-tech-center-with-focus-on-rd-in-ai-and-software/,1,1,2
62,73,"The model is expected to be ready for commercial sale in two months and will cost at least S$100,000, says the founder and director of Aitech Robotics and Automation.  SINGAPORE: Local start-up Aitech Robotics and Automation (R&A) has developed a robotic prototype to make deliveries for food and beverage (F&B) outlets, it announced on Tuesday (Mar 29).  This robot can be deployed in F&B outlets or in office buildings to facilitate the delivery of orders, which customers can make through a mobile application. If deployed in an office building, it will also be able to sense the different levels in an elevator to make deliveries to the right floors.  The model will be ready for commercial sale in two months and will cost at least S$100,000, said Aitech R&A founder and director Mr Eric Lee.     There will also be an option to lease the robot for about S$30,000 to S$40,000 a year, he added.     Minister for Trade and Industry (Industry) S Iswaran said the leasing model could help lessen upfront financial costs and reduce potential barriers to adoption, especially for small- and medium-sized enterprises (SMEs).  GOVERNMENT WANTS TO HELP FIRMS ADOPT ROBOTICS TECHNOLOGIES: ISWARAN  The global robotics industry is growing from S$20 billion to S$80 billion over the next decade, and the Government is looking at helping more SMEs adopt such technologies, according to Mr Iswaran.  The Government recently announced that it will put in S$450 million over the next three years into the National Robotics Programme.  ""Given the range of applications, we want to see how these robotics solutions can be incorporated in some of the existing businesses, partly maybe as a solution to their productivity or manpower needs, partly also because it will allow them to pursue new types of opportunities, said Mr Iswaran.  While the deployment of robotics could result in certain jobs being diminished, new jobs such as offering maintenance support for robots would also be created, Mr Iswaran added. ""What we have to do at a system level is to find ways for Singaporeans to pick up the skills and adapt to new opportunities,"" he said.",2016-03-29,"SINGAPORE: Local start-up Aitech Robotics and Automation (R&A) has ... more SMEs adopt such technologies, according to Mr Iswaran.",Singapore start-up develops robot for food delivery,http://www.channelnewsasia.com/news/business/singapore-start-up/2645784.html,6,6,2
63,75,"Tech toys are all the rage now.  Not only are they being introduced and used widely in schools, but when Science Centre Singapore (SCS) and the Infocomm Media Development Authority (IMDA) unveiled the PlayMaker Studio @ KidsSTOP in January, the trendy toys took centre stage.  The collaboration aims to provide a community space where children can take part in hands-on activities to create things using an array of tech toys and tools.  The PlayMaker Studio combines playing and tinkering, allowing children to experiment with materials to understand what they can do and create new solutions. Children can pick up a host of skills and hone their logical thinking and reasoning, all while bonding with peers.  This is part of ongoing efforts by SCS to spark a lasting interest among young children in science, technology, engineering and mathematics (Stem). Together with IMDA, SCS will curate and update the collection of tech toys at the space to sustain and deepen that interest.  SCS chief Lim Tit Meng hopes this ""meaningful venture"" will inspire the next generation of tinkerers.  Said Associate Professor Lim: ""A tinkering and making mindset among young children can inspire them to inquire, investigate and innovate.""  IMDA chief Tan Kiat How said the space will help prepare children to live, play and work in a Smart Nation.  ""The workshops offered at PlayMaker Studio will help children develop logical thinking and sequencing at an early age, and prime them with the relevant skill sets to thrive in a digitally rich future,"" he added.  SCS and IMDA will conduct workshops and programmes, facilitated by KidsSTOP educators, for the community as well. Established makers might also be invited to the space, to share their passion and interest in tinkering and making.  The PlayMaker Studio aims to reach out to 3,500 children by the end of the year.  Check out these cool tech toys and how they teach young ones new skills.  What is it A cute, bee-shaped floor robot used to teach concepts such as sequencing (when one action leads to the next in a predetermined order), estimation and problem-solving.  What you do: Colourful and easy to operate, the Bee-Bot is controlled by directional keys on its back - just press them to move it forward and backward or left and right. You can create your own activities and games, and use the Bee-Bot to reach various objectives.  For example, place it on a mat covered with pictures of different types of food, and use it to choose healthy options to ""fill"" a plate.  What is it A robot kit - made up of various ""body parts"" and wooden blocks - that is designed for free play and teaches sequencing.  What you do: Build your very own robot and decorate it using Kibo parts and/or other materials, such as coloured paper or straws, and then make it do what you want.  The robot's body has a scanner that lets you scan barcodes printed on colour-coded wooden blocks. Each block's barcode contains an instructional code (for making it sing or spin, for example). When they are put together, the string of instructions will provide a sequence of actions for your Kibo to perform.  What is it A vibrating, motorised contraption that moves in unusual ways and leaves a mark to trace its path. It teaches general concepts about electrical circuits, among other things.  The outcome from each machine might vary because users can change the variables (such as the length and weight of the motors, the drawing method or the speed of the motors).  What you do: Each Scribbling Machine is unique, and usually consists of drawing tools and a motorised base.  Anyone can build and customise his own machine, using simple materials such as markers, masking tape and batteries.  Different machine designs produce different patterns, such as smooth or jagged lines, or circles in various sizes.  Varying the materials, which can include paint and paintbrushes, markers, chalk or colour pencils, for the machine's ""legs"" will result in varying patterns as well.",2017-03-05,"Not only are they being introduced and used widely in schools, but when Science Centre Singapore (SCS) and the Infocomm Media ...","Tech toys steal the show at school, playtime",http://www.straitstimes.com/singapore/tech-toys-steal-the-show-at-school-playtime,4,4,1
64,76,Senior Minister of State Josephine Teo observing a trial of the Double Robotics interface. Photo: Angela Teng/TODAY,2016-11-28,SINGAPORE — Ms Roxanne Lu may be away from her office but she can ... in the technology to improve work-life balance for its employees.,Let a robot go to the office for you,http://www.todayonline.com/business/let-robot-go-office-you,5,6,2
